{
  "schema_version": "continuity_packet.v0",
  "case_id": "D-B08",
  "session_id": "D-B08-S03",
  "plugin_type": "divorce",
  "support_artifact_policy_descriptor": "d_b08_support_process_breakdown",
  "support_artifact_review_focus": "fairness_process_breakdown",
  "category_family": "fairness_or_process_breakdown",
  "recommended_human_role": "co_handling",
  "handoff_focus": "restore fair participation and workable process control before substantive option work continues",
  "escalation": {
    "category": "E2",
    "threshold_band": "T2",
    "mode": "M3",
    "rationale": "Co-handling is required because the state reflects a fairness or repeated-process breakdown that needs live human mediation support."
  },
  "summary_state": {
    "issues": [],
    "next_step": "Use the next step to bring in a human mediator for co-handling, restore fair participation, and avoid further autonomous option work until process balance is re-established."
  },
  "issues": [],
  "open_missing_info": [],
  "active_flags": [
    {
      "flag_id": "d-b08-flag-fairness",
      "flag_type": "fairness_breakdown",
      "severity": 3,
      "source": "platform",
      "first_detected_turn": 2,
      "last_updated_turn": 4,
      "related_categories": [
        "E2"
      ],
      "threshold_band": "T2",
      "title": "Participation fairness appears compromised",
      "note": "The current turn suggests one-sidedness, unfair pressure, or meaningful participation imbalance.",
      "signal_classes": [
        "fairness_breakdown"
      ],
      "related_issues": [
        "communication_protocol",
        "fairness_and_parent_role"
      ],
      "source_turns": [
        2,
        4
      ],
      "status": "active",
      "hard_trigger": false,
      "cleared_turn": null
    },
    {
      "flag_id": "d-b08-flag-process-breakdown",
      "flag_type": "repeated_process_breakdown",
      "severity": 3,
      "source": "platform",
      "first_detected_turn": 4,
      "last_updated_turn": 4,
      "related_categories": [
        "E2"
      ],
      "threshold_band": "T2",
      "title": "Repeated process breakdown remains active",
      "note": "The turn suggests repair attempts are not restoring workable participation.",
      "signal_classes": [
        "repeated_process_breakdown"
      ],
      "related_issues": [
        "communication_protocol",
        "fairness_and_parent_role"
      ],
      "source_turns": [
        4
      ],
      "status": "active",
      "hard_trigger": false,
      "cleared_turn": null
    },
    {
      "flag_id": "d-b08-flag-human-request",
      "flag_type": "explicit_human_request",
      "severity": 3,
      "source": "participant",
      "first_detected_turn": 4,
      "last_updated_turn": 6,
      "related_categories": [
        "E3"
      ],
      "threshold_band": "T2",
      "title": "A party requested human involvement",
      "note": "The run should preserve a clear human-review path when a party explicitly requests it.",
      "signal_classes": [
        "explicit_human_request"
      ],
      "related_issues": [
        "communication_protocol",
        "fairness_and_parent_role"
      ],
      "source_turns": [
        4,
        6
      ],
      "status": "active",
      "hard_trigger": false,
      "cleared_turn": null
    }
  ],
  "package_snapshot": null,
  "plugin_assessment": {
    "plugin_confidence": "moderate",
    "supports_fixed_recommendation": true,
    "warnings": []
  },
  "recent_turn_summaries": [
    {
      "turn_index": 4,
      "role": "client",
      "phase": "interest_exploration",
      "message_summary": "Parent B says they keep getting cut off, no longer believe the discussion is balanced, and are starting to doubt whether continuing without a human mediator is workable."
    },
    {
      "turn_index": 5,
      "role": "assistant",
      "phase": "option_generation",
      "message_summary": "Mediator directly acknowledges Party B's fairness concern, takes responsibility for the participation imbalance, names the interruption pattern explicitly, commits to enforced turn protection, and gives Party B extended protected space to speak with visible enforcement."
    },
    {
      "turn_index": 6,
      "role": "client",
      "phase": "option_generation",
      "message_summary": "Parent B agrees a human mediator should join before the discussion continues, and parent a says they are frustrated but willing to continue with clearer live process control."
    }
  ],
  "case_title": "Repeated interruption and procedural domination with co-handling escalation"
}
